{
  "schema": "noss.platform/1",
  "id": "official.endless.sport",
  "name": "Sport",
  "version": "0.1.0",
  "family": "car",
  "modes": ["endless"],
  "accepts_families": ["car"],

  "layout": {
    "drive": "rwd",
    "axles": [
      { "steer": true, "driven": false, "wheels": 2 },
      { "steer": false, "driven": true, "wheels": 2 }
    ]
  },

  "geometry": {
    "wheelbase_m": { "ref": 2.60, "min": 2.30, "max": 3.00 },
    "track_m": { "ref": 1.60, "min": 1.45, "max": 1.80 },
    "ride_height_m": { "ref": 0.11, "min": 0.07, "max": 0.17 },
    "wheel_radius_m": { "ref": 0.33, "min": 0.29, "max": 0.38 },
    "envelope_m": { "length": [3.8, 5.0], "width": [1.70, 2.05], "height": [1.05, 1.55] }
  },

  "mass": {
    "kg": 1350,
    "front_weight": 0.50,
    "cog_height_over_track": 0.30,
    "yaw_dynamic_index": 0.97
  },

  "engine": {
    "torque_curve_nm": [[1000, 250], [2500, 370], [4000, 420], [5500, 410], [6800, 365], [7300, 330], [7600, 300]],
    "idle_rpm": 850,
    "redline_rpm": 7300,
    "limiter_rpm": 7600,
    "inertia_kgm2": 0.15,
    "engine_brake_nm": 65
  },
  "gearbox": {
    "type": "sequential",
    "ratios": [3.20, 2.20, 1.65, 1.30, 1.08, 0.90],
    "reverse": 3.1,
    "final_drive": 3.70,
    "shift_time_s": 0.10
  },
  "differential": { "type": "lsd_clutch", "preload_nm": 60, "power_lock": 0.40, "coast_lock": 0.20 },
  "brakes": { "max_torque_nm": 5800, "bias_front": 0.62 },
  "suspension": {
    "front": { "freq_hz": 2.1, "damping_bump": 0.50, "damping_rebound": 0.70, "travel_m": 0.10 },
    "rear": { "freq_hz": 2.2, "damping_bump": 0.50, "damping_rebound": 0.70, "travel_m": 0.11 },
    "roll_gradient_deg_per_g": 1.3,
    "roll_stiffness_front_share": 0.57
  },
  "steering": { "max_road_angle_deg": 30, "wheel_rotation_deg": 720 },
  "aero": { "cd_a": 0.70, "cl_a_front": -0.15, "cl_a_rear": -0.25, "slipstream": false },
  "tires": {
    "model": "pacejka_lite",
    "compound": "sport",
    "mu_peak": 1.22,
    "load_sensitivity": 0.09,
    "peak_slip_ratio": 0.11,
    "peak_slip_angle_deg": 8.0,
    "relaxation_length_m": 0.28,
    "rolling_resistance": 0.012,
    "wear": false,
    "temperature": false
  },

  "assists_allowed": ["abs", "tcs", "stability", "auto_gearbox", "auto_clutch", "steer_aid", "auto_throttle", "brake_assist", "steering_assist", "autodrive"],
  "damage": { "cosmetic": true, "mechanical": [] },

  "tunable": {},

  "ffb": { "reference_rack_nm": 8.0 }
}
